shortname,fullname,summary,templatecourse,category,enablecompletion,format,visible
"SISCCRD302A | SISXCCS201A | SISXFAC207 | SISXRES301A: Recreation management cluster (Sport, ID17)","SISCCRD302A | SISXCCS201A | SISXFAC207 | SISXRES301A: Recreation management cluster (Sport, ID17)","SISCCRD302A - Recruit and manage volunteers, SISXCCS201A - Provide customer service, SISXFAC207 - Maintain sport, fitness and recreation equipment for activities, SISXRES301A - Provide public education on the use of resources",SISXCCS201A | SISXRES301A | SISXFAC207-SISCCRD302A: Recreation Management Cluster SIS30213 (Sport) 2,1392,1,onetopic,0
"CHCYTH301E | SISXCAI001 | SISXCAI003 | SISXCAI006: Coaching Cluster (Sport, ID17)","CHCYTH301E | SISXCAI001 | SISXCAI003 | SISXCAI006: Coaching Cluster (Sport, ID17)","CHCYTH301B: Work effectively with young people, SISXCAI101A: Provide equipment for activities, SISXCAI303A: Plan and conduct sport and recreation sessions, SISXCAI306A: Facilitate groups",SIS30213 Coach (Sport) (SE) 2016,1392,1,onetopic,0
"SIS31015: Certificate III in Aquatics and Community Recreation Course Home (Sport, #XXXX ID17)","SIS31015: Certificate III in Aquatics and Community Recreation Course Home (Sport, #XXXX ID17)",,Template Course Home (ID17),1392,1,onetopic,0
"BSBWOR301 | CHCCDE002 | SISFFIT011 | SISXCAI007 | SISXIND001:  Sport Industry Cluster (Sport, ID17)","BSBWOR301 | CHCCDE002 | SISFFIT011 | SISXCAI007 | SISXIND001:  Sport Industry Cluster (Sport, ID17)","BSBWOR301 - Organise personal work priorities and development, CHCCDE002 - Develop and implement community programs, SISFFIT011 - Instruct approved community fitness programs, SISXCAI007 - Assist with activities not requiring, SISXIND001 - Work effectively in sport, fitness and recreation environments",SISXIND101A | BSBWOR301A | SISCCRD304A: Working in the Sporting Industry Cluster SIS30213  (Sport) (SE) 2016,1392,1,onetopic,0
"BSBRSK401 | HLTAID003 | SISXEMR001: Sport Law Cluster (Sport, ID17)","BSBRSK401 | HLTAID003 | SISXEMR001: Sport Law Cluster (Sport, ID17)","BSBRSK401 - Identify risk and apply risk management processes, HLTAID003 - Provide first aid, SISXEMR001 - Respond to emergency situations",SIS30213 SptLaw CL (SE) 2016,1392,1,onetopic,0